{
  "id": "119-house-2-276",
  "chamber": "House",
  "congress": 119,
  "session": 2,
  "rollNumber": 276,
  "date": "2026-07-22",
  "question": "On Agreeing to the Amendment",
  "description": "National Defense Authorization Act for Fiscal Year 2027 (HR 8800)",
  "result": "Failed",
  "yea": 175,
  "nay": 254,
  "present": 0,
  "notVoting": 7,
  "associatedBillId": "119-hr-8800",
  "associatedBillTitle": "National Defense Authorization Act for Fiscal Year 2027",
  "memberRecords": [
    {
      "memberId": "A000055",
      "memberName": "Robert Aderholt",
      "party": "R",
      "state": "AL",
      "vote": "Yea"
    },
    {
      "memberId": "A000148",
      "memberName": "Jake Auchincloss",
      "party": "D",
      "state": "MA",
      "vote": "Nay"
    },
    {
      "memberId": "A000369",
      "memberName": "Mark Amodei",
      "party": "R",
      "state": "NV",
      "vote": "Yea"
    },
    {
      "memberId": "A000370",
      "memberName": "Alma Adams",
      "party": "D",
      "state": "NC",
      "vote": "Nay"
    },
    {
      "memberId": "A000371",
      "memberName": "Pete Aguilar",
      "party": "D",
      "state": "CA",
      "vote": "Nay"
    },
    {
      "memberId": "A000372",
      "memberName": "Rick Allen",
      "party": "R",
      "state": "GA",
      "vote": "Yea"
    },
    {
      "memberId": "A000375",
      "memberName": "Jodey Arrington",
      "party": "R",
      "state": "TX",
      "vote": "Yea"
    },
    {
      "memberId": "A000379",
      "memberName": "Mark Alford",
      "party": "R",
      "state": "MO",
      "vote": "Yea"
    },
    {
      "memberId": "A000380",
      "memberName": "Gabe Amo",
      "party": "D",
      "state": "RI",
      "vote": "Nay"
    },
    {
      "memberId": "A000381",
      "memberName": "Yassamin Ansari",
      "party": "D",
      "state": "AZ",
      "vote": "Nay"
    },
    {
      "memberId": "B000490",
      "memberName": "Sanford Bishop",
      "party": "D",
      "state": "GA",
      "vote": "Nay"
    },
    {
      "memberId": "B000668",
      "memberName": "Cliff Bentz",
      "party": "R",
      "state": "OR",
      "vote": "Yea"
    },
    {
      "memberId": "B000740",
      "memberName": "Stephanie Bice",
      "party": "R",
      "state": "OK",
      "vote": "Yea"
    },
    {
      "memberId": "B000825",
      "memberName": "Lauren Boebert",
      "party": "R",
      "state": "CO",
      "vote": "Yea"
    },
    {
      "memberId": "B001257",
      "memberName": "Gus Bilirakis",
      "party": "R",
      "state": "FL",
      "vote": "Yea"
    },
    {
      "memberId": "B001260",
      "memberName": "Vern Buchanan",
      "party": "R",
      "state": "FL",
      "vote": "Yea"
    },
    {
      "memberId": "B001278",
      "memberName": "Suzanne Bonamici",
      "party": "D",
      "state": "OR",
      "vote": "Nay"
    },
    {
      "memberId": "B001281",
      "memberName": "Joyce Beatty",
      "party": "D",
      "state": "OH",
      "vote": "Nay"
    },
    {
      "memberId": "B001282",
      "memberName": "Andy Barr",
      "party": "R",
      "state": "KY",
      "vote": "Yea"
    },
    {
      "memberId": "B001285",
      "memberName": "Julia Brownley",
      "party": "D",
      "state": "CA",
      "vote": "Nay"
    },
    {
      "memberId": "B001287",
      "memberName": "Ami Bera",
      "party": "D",
      "state": "CA",
      "vote": "Nay"
    },
    {
      "memberId": "B001291",
      "memberName": "Brian Babin",
      "party": "R",
      "state": "TX",
      "vote": "Yea"
    },
    {
      "memberId": "B001292",
      "memberName": "Donald Beyer",
      "party": "D",
      "state": "VA",
      "vote": "Nay"
    },
    {
      "memberId": "B001295",
      "memberName": "Mike Bost",
      "party": "R",
      "state": "IL",
      "vote": "Nay"
    },
    {
      "memberId": "B001296",
      "memberName": "Brendan Boyle",
      "party": "D",
      "state": "PA",
      "vote": "Nay"
    },
    {
      "memberId": "B001298",
      "memberName": "Don Bacon",
      "party": "R",
      "state": "NE",
      "vote": "Yea"
    },
    {
      "memberId": "B001300",
      "memberName": "Nanette Barragán",
      "party": "D",
      "state": "CA",
      "vote": "Nay"
    },
    {
      "memberId": "B001301",
      "memberName": "Jack Bergman",
      "party": "R",
      "state": "MI",
      "vote": "Yea"
    },
    {
      "memberId": "B001302",
      "memberName": "Andy Biggs",
      "party": "R",
      "state": "AZ",
      "vote": "NotVoting"
    },
    {
      "memberId": "B001306",
      "memberName": "Troy Balderson",
      "party": "R",
      "state": "OH",
      "vote": "Yea"
    },
    {
      "memberId": "B001307",
      "memberName": "James Baird",
      "party": "R",
      "state": "IN",
      "vote": "Yea"
    },
    {
      "memberId": "B001309",
      "memberName": "Tim Burchett",
      "party": "R",
      "state": "TN",
      "vote": "Yea"
    },
    {
      "memberId": "B001313",
      "memberName": "Shontel Brown",
      "party": "D",
      "state": "OH",
      "vote": "Nay"
    },
    {
      "memberId": "B001314",
      "memberName": "Aaron Bean",
      "party": "R",
      "state": "FL",
      "vote": "Yea"
    },
    {
      "memberId": "B001315",
      "memberName": "Nikki Budzinski",
      "party": "D",
      "state": "IL",
      "vote": "Nay"
    },
    {
      "memberId": "B001316",
      "memberName": "Eric Burlison",
      "party": "R",
      "state": "MO",
      "vote": "Yea"
    },
    {
      "memberId": "B001317",
      "memberName": "Josh Brecheen",
      "party": "R",
      "state": "OK",
      "vote": "Yea"
    },
    {
      "memberId": "B001318",
      "memberName": "Becca Balint",
      "party": "D",
      "state": "VT",
      "vote": "Nay"
    },
    {
      "memberId": "B001321",
      "memberName": "Tom Barrett",
      "party": "R",
      "state": "MI",
      "vote": "Yea"
    },
    {
      "memberId": "B001322",
      "memberName": "Michael Baumgartner",
      "party": "R",
      "state": "WA",
      "vote": "Yea"
    },
    {
      "memberId": "B001323",
      "memberName": "Nicholas Begich",
      "party": "R",
      "state": "AK",
      "vote": "Nay"
    },
    {
      "memberId": "B001324",
      "memberName": "Wesley Bell",
      "party": "D",
      "state": "MO",
      "vote": "Nay"
    },
    {
      "memberId": "B001325",
      "memberName": "Sheri Biggs",
      "party": "R",
      "state": "SC",
      "vote": "Yea"
    },
    {
      "memberId": "B001326",
      "memberName": "Janelle Bynum",
      "party": "D",
      "state": "OR",
      "vote": "Nay"
    },
    {
      "memberId": "B001327",
      "memberName": "Robert Bresnahan",
      "party": "R",
      "state": "PA",
      "vote": "Nay"
    },
    {
      "memberId": "C000059",
      "memberName": "Ken Calvert",
      "party": "R",
      "state": "CA",
      "vote": "Yea"
    },
    {
      "memberId": "C000537",
      "memberName": "James Clyburn",
      "party": "D",
      "state": "SC",
      "vote": "Nay"
    },
    {
      "memberId": "C001039",
      "memberName": "Kat Cammack",
      "party": "R",
      "state": "FL",
      "vote": "Yea"
    },
    {
      "memberId": "C001051",
      "memberName": "John Carter",
      "party": "R",
      "state": "TX",
      "vote": "Yea"
    },
    {
      "memberId": "C001053",
      "memberName": "Tom Cole",
      "party": "R",
      "state": "OK",
      "vote": "Yea"
    },
    {
      "memberId": "C001055",
      "memberName": "Ed Case",
      "party": "D",
      "state": "HI",
      "vote": "Nay"
    },
    {
      "memberId": "C001059",
      "memberName": "Jim Costa",
      "party": "D",
      "state": "CA",
      "vote": "Nay"
    },
    {
      "memberId": "C001061",
      "memberName": "Emanuel Cleaver",
      "party": "D",
      "state": "MO",
      "vote": "Nay"
    },
    {
      "memberId": "C001063",
      "memberName": "Henry Cuellar",
      "party": "D",
      "state": "TX",
      "vote": "Nay"
    },
    {
      "memberId": "C001066",
      "memberName": "Kathy Castor",
      "party": "D",
      "state": "FL",
      "vote": "Nay"
    },
    {
      "memberId": "C001067",
      "memberName": "Yvette Clarke",
      "party": "D",
      "state": "NY",
      "vote": "Nay"
    },
    {
      "memberId": "C001068",
      "memberName": "Steve Cohen",
      "party": "D",
      "state": "TN",
      "vote": "Nay"
    },
    {
      "memberId": "C001069",
      "memberName": "Joe Courtney",
      "party": "D",
      "state": "CT",
      "vote": "Nay"
    },
    {
      "memberId": "C001072",
      "memberName": "André Carson",
      "party": "D",
      "state": "IN",
      "vote": "Nay"
    },
    {
      "memberId": "C001080",
      "memberName": "Judy Chu",
      "party": "D",
      "state": "CA",
      "vote": "Nay"
    },
    {
      "memberId": "C001087",
      "memberName": "Eric Crawford",
      "party": "R",
      "state": "AR",
      "vote": "Yea"
    },
    {
      "memberId": "C001091",
      "memberName": "Joaquin Castro",
      "party": "D",
      "state": "TX",
      "vote": "Nay"
    },
    {
      "memberId": "C001101",
      "memberName": "Katherine Clark",
      "party": "D",
      "state": "MA",
      "vote": "Nay"
    },
    {
      "memberId": "C001103",
      "memberName": "Earl Carter",
      "party": "R",
      "state": "GA",
      "vote": "Yea"
    },
    {
      "memberId": "C001108",
      "memberName": "James Comer",
      "party": "R",
      "state": "KY",
      "vote": "Yea"
    },
    {
      "memberId": "C001110",
      "memberName": "J. Correa",
      "party": "D",
      "state": "CA",
      "vote": "Nay"
    },
    {
      "memberId": "C001112",
      "memberName": "Salud Carbajal",
      "party": "D",
      "state": "CA",
      "vote": "Nay"
    },
    {
      "memberId": "C001115",
      "memberName": "Michael Cloud",
      "party": "R",
      "state": "TX",
      "vote": "Nay"
    },
    {
      "memberId": "C001116",